{
  "run_id": "rr_8U0I2O4P",
  "status": "completed",
  "summary": {
    "run_id": "rr_8U0I2O4P",
    "seed_domain": "example.com",
    "generated_at": "2026-04-03T12:32:00Z",
    "assets": [
      {
        "asset": "mail.example.com",
        "asset_type": "hostname",
        "findings": [
          {
            "finding_id": "f_1K3M5P7R",
            "title": "DMARC policy is absent",
            "severity": "medium",
            "confidence": "high",
            "source_type": "email_posture",
            "evidence_ref": "ev_9S1U3W5Y"
          }
        ]
      }
    ]
  },
  "receipt_summary": [
    {
      "receipt_class": "offsec_execution_outcome",
      "receipt_id": "rcpt_offsec_execution_outcome_002",
      "status": "ready",
      "created_at": "2026-04-03T12:32:00Z",
      "hash": "9999999999999999999999999999999999999999999999999999999999999999",
      "uri": "https://example.com/receipts/rcpt_offsec_execution_outcome_002"
    }
  ],
  "bundle": null
}
